{
  "$schema": "../../schemas/brand-pack.schema.json",
  "brandId": "reality-architect",
  "displayName": "Reality Architect",
  "operatingUnit": "reality-architect",
  "sourceDocs": ["brand-image-system/source-map.md"],
  "canonicalRepos": [],
  "audiences": ["reflective builders", "people designing intentional practices"],
  "positioning": {
    "oneLine": "Grounded life-design practices expressed through choices, maps, and repeatable rituals.",
    "proof": ["decision maps", "practice records", "before-and-after behavior"],
    "failureModes": ["vague mysticism", "therapy claims", "aestheticized self-help"]
  },
  "voice": {
    "traits": ["grounded", "reflective", "plainspoken", "careful"],
    "bannedPhrases": ["manifest anything", "quantum leap", "your highest self"]
  },
  "visual": {
    "principles": ["Make reflection tangible", "Prefer lived evidence", "Use quiet hierarchy"],
    "colors": { "ink": "#171513", "paper": "#f4efe6", "earth": "#9a6f4f" },
    "typography": { "displayRole": "reflective authority", "readingRole": "slow, accessible reading" },
    "imageDirection": ["real environments", "annotated maps", "material practice artifacts"]
  },
  "channels": { "primary": ["editorial", "workshops", "practice material"] },
  "approvals": { "requiredBeforePublicAction": true, "route": "named-human" },
  "doNotUse": ["clinical claims", "cosmic stock imagery", "generic sacred geometry"],
  "updatedAt": "2026-07-24"
}
