{
  "$schema": "../../schemas/brand-pack.schema.json",
  "brandId": "starlight-technology",
  "displayName": "Starlight Technology",
  "operatingUnit": "buying-intelligence",
  "sourceDocs": ["brand-packs/starlight-technology/BRAND.md", "brand-packs/starlight-technology/DESIGN.md"],
  "canonicalRepos": ["frankxai/starlight-technology"],
  "surfaceModes": ["buying-guide", "comparison", "system-builder"],
  "audiences": ["AI-native creators", "small creative teams", "local-AI buyers"],
  "positioning": {
    "oneLine": "Evidence-led buying intelligence for complete creator and local-AI systems.",
    "proof": ["source dates", "evidence status", "complete-system cost", "wrong-purchase conditions"],
    "failureModes": ["affiliate-first rankings", "research presented as hands-on testing", "single-product tunnel vision"]
  },
  "voice": {
    "traits": ["practical", "transparent", "comparative", "buyer-aligned"],
    "bannedPhrases": ["best for everyone", "must buy", "future-proof setup"]
  },
  "visual": {
    "principles": ["Make evidence status visible", "Compare complete systems", "Keep caveats adjacent"],
    "colors": { "ink": "#111418", "paper": "#f5f7f8", "signal": "#2563eb", "caution": "#b45309" },
    "typography": { "displayRole": "editorial authority", "readingRole": "comparison clarity" },
    "imageDirection": ["sourced product evidence", "real complete systems", "compatibility diagrams"]
  },
  "channels": { "primary": ["website", "buying guides", "comparison tools"] },
  "approvals": { "requiredBeforePublicAction": true, "route": "evidence-review-and-named-human" },
  "doNotUse": ["generic affiliate listicles", "fake lab photography", "uncited benchmark charts"],
  "updatedAt": "2026-09-02"
}
