{
  "$schema": "../../schemas/brand-pack.schema.json",
  "brandId": "animelegends",
  "displayName": "AnimeLegends",
  "operatingUnit": "original-worlds",
  "sourceDocs": ["brand-packs/animelegends/BRAND.md", "brand-packs/animelegends/DESIGN.md"],
  "canonicalRepos": ["frankxai/AnimeLegends"],
  "surfaceModes": ["studio-cinematic", "atlas-editorial", "forge-technical"],
  "audiences": ["original-world fans", "character storytellers", "creator-developers"],
  "positioning": {
    "oneLine": "An original character world whose Studio, Atlas, and Forge reveal story, scholarship, and craft.",
    "proof": ["AKASHI character study", "documented canon", "Atlas scholarship", "open Forge"],
    "failureModes": ["franchise imitation", "drafts presented as releases", "tools leading before the world"]
  },
  "voice": {
    "traits": ["mythic", "specific", "cinematic", "canon-aware"],
    "bannedPhrases": ["official anime", "inspired by your favorite franchise", "copyright-free character"]
  },
  "visual": {
    "principles": ["The world leads", "One character owns a scene", "State provenance and release status"],
    "colors": { "ink": "#07080d", "paper": "#f2ede3", "threshold": "#dc4c3f", "aether": "#6d5bd0" },
    "typography": { "displayRole": "cinematic chapter title", "readingRole": "atlas scholarship" },
    "imageDirection": ["canonical character studies", "released original scenes", "inspectable production artifacts"]
  },
  "channels": { "primary": ["website", "released media", "Atlas", "Forge"] },
  "approvals": { "requiredBeforePublicAction": true, "route": "rights-review-and-named-human" },
  "doNotUse": ["existing anime marks", "lookalike characters", "unreleased draft framed as finished", "untracked generated media"],
  "updatedAt": "2026-09-02"
}
