{
  "$schema": "../../schemas/brand-pack.schema.json",
  "brandId": "sis",
  "displayName": "Starlight Intelligence Systems",
  "operatingUnit": "starlight-substrate",
  "sourceDocs": ["brand-packs/sis/NARRATIVE.md", "brand-packs/sis/DESIGN.md"],
  "canonicalRepos": ["frankxai/starlight-intelligence-system"],
  "surfaceModes": ["operations", "evidence", "editorial"],
  "audiences": ["AI platform leaders", "operators", "evaluation and governance teams"],
  "positioning": {
    "oneLine": "Calm operational intelligence that makes agent work, evidence, and decisions legible.",
    "proof": ["agent traces", "evaluation deltas", "provenance records", "governed handoffs"],
    "failureModes": ["hype science fiction", "generic dashboard filler", "black-box intelligence"]
  },
  "voice": {
    "traits": ["calm", "operational", "evidence-led", "trustworthy"],
    "bannedPhrases": ["sentient system", "autonomous revolution", "magic intelligence"]
  },
  "visual": {
    "principles": ["Show the trace", "Make confidence inspectable", "Keep operational reading stable"],
    "colors": { "void": "#0a0a0b", "space": "#111113", "signal": "#6366f1", "evidence": "#a5b4fc" },
    "typography": { "displayRole": "operational authority", "readingRole": "dense but calm UI" },
    "imageDirection": ["real product states", "evidence stacks", "agent and evaluation traces"]
  },
  "channels": { "primary": ["product", "enterprise website", "technical documentation"] },
  "approvals": { "requiredBeforePublicAction": true, "route": "independent-verifier-and-named-human" },
  "doNotUse": ["radiant particle fields", "moving dashboards during reading", "uncited confidence claims"],
  "updatedAt": "2026-10-08"
}
