{
  "$schema": "../../schemas/brand-pack.schema.json",
  "brandId": "ai-architect-academy",
  "displayName": "AI Architect Academy",
  "operatingUnit": "ai-architect-academy",
  "sourceDocs": ["brand-packs/ai-architect-academy/COPY.md"],
  "canonicalRepos": ["frankxai/ai-architect-academy"],
  "surfaceModes": ["technical-learning", "workshop"],
  "audiences": ["solution architects", "senior engineers", "technical founders", "enterprise AI leaders"],
  "positioning": {
    "oneLine": "Production judgment and architecture practice for people responsible for AI systems.",
    "proof": ["reference architectures", "decision records", "working labs", "primary documentation"],
    "failureModes": ["beginner filler", "framework worship", "decorative architecture"]
  },
  "voice": {
    "traits": ["rigorous", "opinionated", "technical", "economical"],
    "bannedPhrases": ["future-proof architecture", "complete AI mastery", "industry-leading curriculum"]
  },
  "visual": {
    "principles": ["Show the decision", "Connect choice to consequence", "Prefer reproducible evidence"],
    "colors": { "ink": "#090d12", "paper": "#f8fafc", "signal": "#3b82f6" },
    "typography": { "displayRole": "technical authority", "readingRole": "dense learning with clear hierarchy" },
    "imageDirection": ["architecture diagrams", "working labs", "decision and evaluation artifacts"]
  },
  "channels": { "primary": ["academy", "workshops", "technical editorial"] },
  "approvals": { "requiredBeforePublicAction": true, "route": "independent-verifier-and-named-human" },
  "doNotUse": ["generic graduation imagery", "vendor logo walls", "claims without reproducible proof"],
  "updatedAt": "2026-08-28"
}
