{
  "$schema": "../../schemas/brand-pack.schema.json",
  "brandId": "blue-life-commons",
  "displayName": "Blue Life Commons",
  "operatingUnit": "blue-life-commons",
  "sourceDocs": ["brand-packs/blue-life-commons/COPY.md"],
  "canonicalRepos": ["frankxai/blue-life-commons"],
  "surfaceModes": ["civic-editorial", "project-evidence"],
  "audiences": ["coastal communities", "scientists", "funders", "policymakers"],
  "positioning": {
    "oneLine": "Place-based stewardship systems for shared coastal knowledge, governance, and action.",
    "proof": ["local measurements", "published evidence", "community decisions", "responsible owners"],
    "failureModes": ["greenwashing", "doom spectacle", "savior narratives"]
  },
  "voice": {
    "traits": ["clear", "humane", "ecological", "place-based"],
    "bannedPhrases": ["save the planet", "sustainable future for all", "nature-positive revolution"]
  },
  "visual": {
    "principles": ["Name the place", "Show the evidence", "Keep community agency visible"],
    "colors": { "deep": "#052f3a", "paper": "#f2f7f5", "water": "#0e7490", "life": "#16a34a" },
    "typography": { "displayRole": "civic clarity", "readingRole": "accessible evidence and governance" },
    "imageDirection": ["owned coastal photography", "maps and measurements", "community stewardship work"]
  },
  "channels": { "primary": ["public website", "project reports", "community material"] },
  "approvals": { "requiredBeforePublicAction": true, "route": "evidence-review-and-named-human" },
  "doNotUse": ["generic ocean stock", "unsourced environmental claims", "community-free campaign imagery"],
  "updatedAt": "2026-08-28"
}
