{
  "$schema": "../../schemas/brand-pack.schema.json",
  "brandId": "frankx",
  "displayName": "FrankX",
  "operatingUnit": "frankx-demand",
  "sourceDocs": [
    "brand-packs/frankx/NARRATIVE.md",
    "brand-packs/frankx/BRAND.md",
    "brand-packs/frankx/COPY.md",
    "brand-packs/frankx/DESIGN.md",
    "brand-packs/frankx/SURFACE_MODES.md",
    "brand-packs/frankx/MOTION.md"
  ],
  "canonicalRepos": ["frankxai/frankx.ai-vercel-website"],
  "surfaceModes": ["editorial", "product", "soul"],
  "audiences": ["founders", "AI-native builders", "creators scaling into systems"],
  "positioning": {
    "oneLine": "A builder-led body of work that turns ambitious AI ideas into legible, usable systems.",
    "proof": ["working products", "source repositories", "real workflows", "specific results"],
    "failureModes": ["generic AI authority", "ecosystem diagrams before human value", "claims without artifacts"]
  },
  "voice": {
    "traits": ["observant", "direct", "specific", "understated"],
    "bannedPhrases": ["sovereign substrate", "the infrastructure already exists", "this is not presentationware"]
  },
  "visual": {
    "principles": [
      "Choose editorial, product, or soul mode before styling",
      "Start with a person, artifact, or working scene",
      "Prefer one authored composition to equal-weight card walls"
    ],
    "colors": { "ink": "#0a0a0b", "paper": "#f3efe7", "tech": "#10b981", "soul": "#f59e0b" },
    "typography": {
      "displayRole": "selected per surface from licensed specimens",
      "readingRole": "high-legibility authored prose",
      "dataRole": "technical evidence only"
    },
    "imageDirection": ["real product proof", "authorized people and artifacts", "documentary source material"]
  },
  "channels": { "primary": ["website", "product", "editorial", "social proof"] },
  "approvals": { "requiredBeforePublicAction": true, "route": "independent-verifier-and-named-human" },
  "doNotUse": ["universal obsidian command center", "liquid-glass card walls", "fake UI", "invented intimacy"],
  "updatedAt": "2026-10-08"
}
