{
  "$schema": "../../schemas/brand-pack.schema.json",
  "brandId": "passive-income",
  "displayName": "Passive Income AI",
  "operatingUnit": "passive-income",
  "sourceDocs": ["brand-packs/passive-income/COPY.md"],
  "canonicalRepos": ["frankxai/dpi"],
  "surfaceModes": ["commercial-editorial", "resource-hub"],
  "audiences": ["creators", "professionals", "small digital-product businesses"],
  "positioning": {
    "oneLine": "Realistic guidance for building recurring digital income with controlled maintenance.",
    "proof": ["asset economics", "distribution records", "support burden", "maintenance cycles"],
    "failureModes": ["overnight income claims", "hidden workload", "false scarcity"]
  },
  "voice": {
    "traits": ["accessible", "precise", "calm", "commercial"],
    "bannedPhrases": ["set and forget", "income on autopilot", "financial freedom overnight"]
  },
  "visual": {
    "principles": ["Explain the asset", "Show the operating loop", "Keep numbers inspectable"],
    "colors": { "ink": "#14110f", "paper": "#faf6ed", "signal": "#d97706" },
    "typography": { "displayRole": "accessible authority", "readingRole": "practical commercial guidance" },
    "imageDirection": ["real digital assets", "simple economics", "distribution and support flows"]
  },
  "channels": { "primary": ["website", "guides", "email"] },
  "approvals": { "requiredBeforePublicAction": true, "route": "named-human" },
  "doNotUse": ["luxury lifestyle bait", "cash imagery", "fake earnings proof"],
  "updatedAt": "2026-08-28"
}
