{
  "$schema": "../../schemas/brand-pack.schema.json",
  "brandId": "ai-coe",
  "displayName": "AI Center of Excellence",
  "operatingUnit": "ai-architect-coe",
  "sourceDocs": ["brand-packs/ai-coe/BRAND.md", "brand-packs/ai-coe/DESIGN.md"],
  "canonicalRepos": ["frankxai/ai-architect-academy"],
  "surfaceModes": ["academy-lab", "coe-governance"],
  "audiences": ["enterprise AI leaders", "architecture teams", "governance owners"],
  "positioning": {
    "oneLine": "Proof-led AI operating architecture for teams that need governable execution.",
    "proof": ["operating models", "decision records", "architecture evidence"],
    "failureModes": ["AI hype", "fake proof", "innovation-theater diagrams"]
  },
  "voice": {
    "traits": ["precise", "evidence-led", "calm", "architectural"],
    "bannedPhrases": ["revolutionary AI", "transform everything", "future-proof"]
  },
  "visual": {
    "principles": ["Show governed work", "Prefer exact diagrams", "Keep executive hierarchy legible"],
    "colors": { "ink": "#0a0a0b", "paper": "#f8fafc", "signal": "#3b82f6" },
    "typography": { "displayRole": "technical authority", "readingRole": "operational clarity" },
    "imageDirection": ["real architecture artifacts", "sourced diagrams", "decision and evaluation evidence"]
  },
  "channels": { "primary": ["website", "presentations", "documentation"] },
  "approvals": { "requiredBeforePublicAction": true, "route": "named-human" },
  "doNotUse": ["hype science fiction", "decorative dashboards", "uncited benchmarks"],
  "updatedAt": "2026-09-02"
}
