{
  "$schema": "../../schemas/brand-pack.schema.json",
  "brandId": "arcanea",
  "displayName": "Arcanea",
  "operatingUnit": "arcanea-product-ip",
  "sourceDocs": ["brand-packs/arcanea/NARRATIVE.md", "brand-packs/arcanea/DESIGN.md", "brand-packs/arcanea/SOURCE_AUTHORITY.md"],
  "canonicalRepos": ["frankxai/arcanea", "frankxai/arcanea-ai-app"],
  "surfaceModes": ["mythic-world", "creator-tool", "lore-editorial"],
  "audiences": ["world-builders", "writers", "visual creators", "creative technologists"],
  "positioning": {
    "oneLine": "A mythic creative-intelligence world that resolves imagination into usable canon and tools.",
    "proof": ["codex artifacts", "world systems", "creator workflows"],
    "failureModes": ["fantasy cosplay", "unreadable lore", "portals that hide the product"]
  },
  "voice": {
    "traits": ["mythic", "exact", "cinematic", "inviting"],
    "bannedPhrases": ["generic magic", "limitless possibilities", "AI-powered fantasy"]
  },
  "visual": {
    "principles": ["Creator artifacts carry the mythology", "Product chrome follows its owning token contract", "Stillness stages a selected world"],
    "colors": {"atlanteanTeal": "#00bcd4", "cosmicBlue": "#0d47a1", "arcaneanGold": "#ffd700"},
    "additionalSourceToken": {"name": "brand.aquamarine", "value": "#7fffd4", "source": "Owning product packages/design-system/src/tokens.ts at 79f3fb25; reference only, new placement unapproved"},
    "colorScope": "Teal/blue/gold references agree between pinned product taste and code. No new palette placement or product adoption is approved here. Background and document conflicts require owner reconciliation before a new product application.",
    "mediaExecutionScope": "Higgsfield tools and skills are prohibited; older source paths and records remain historical audit evidence.",
    "typography": {"displayRole": "product clarity", "displayFamily": "Geist", "readingRole": "creator work and long-form reading", "readingFamily": "Geist", "editorialFamily": "Instrument Serif", "codeFamily": "Geist Mono", "sourceStatus": "Declared owning-product roles; exact files, rights and computed-font adoption unverified"},
    "imageDirection": ["canonical characters", "visitable worlds", "working creator artifacts"]
  },
  "channels": { "primary": ["product", "editorial", "cinematic media"] },
  "approvals": { "requiredBeforePublicAction": true, "route": "named-human" },
  "doNotUse": ["purple cliché", "generic generated texture", "mythology without product consequence", "Higgsfield tools or skills", "Emoji or Unicode glyphs as product icons", "Cinematic reference colors substituted for unresolved product tokens", "Unverified raster or system-font SVG promoted as an approved vector identity master"],
  "updatedAt": "2026-10-08"
}
