{
  "$schema": "../../schemas/brand-pack.schema.json",
  "brandId": "agentic-income",
  "displayName": "Agentic Income",
  "operatingUnit": "agentic-income",
  "sourceDocs": ["brand-packs/agentic-income/NARRATIVE.md", "brand-packs/agentic-income/BRAND.md", "brand-packs/agentic-income/DESIGN.md"],
  "canonicalRepos": ["frankxai/agenticincome"],
  "surfaceModes": ["machinery-editorial", "evidence-library", "offer"],
  "audiences": ["independent operators", "service builders", "agent-system owners"],
  "positioning": {
    "oneLine": "Inspectable machinery for principal-owned agent services, without earnings promises.",
    "proof": ["public skill", "schema", "scaffold", "validator", "attested cases"],
    "failureModes": ["income guarantees", "fake urgency", "unavailable offers presented as live"]
  },
  "voice": {
    "traits": ["direct", "economically literate", "evidence-led", "unsensational"],
    "bannedPhrases": ["passive income guaranteed", "get rich", "make money while you sleep"]
  },
  "visual": {
    "principles": ["Show the machinery", "Date every claim", "Separate available from proposed"],
    "colors": { "ink": "#101213", "paper": "#f4f0e7", "signal": "#d97706", "verified": "#15803d" },
    "typography": { "displayRole": "industrial editorial", "readingRole": "clear operating guidance" },
    "imageDirection": ["real outcome packs", "operating receipts", "sourced economics"]
  },
  "channels": { "primary": ["website", "knowledge base", "public repository"] },
  "approvals": { "requiredBeforePublicAction": true, "route": "independent-verifier-and-named-human" },
  "doNotUse": ["cash imagery", "luxury lifestyle proof", "invented revenue dashboards", "hidden affiliate routes"],
  "updatedAt": "2026-10-08"
}
