{
  "$schema": "../../schemas/brand-pack.schema.json",
  "brandId": "cecilia",
  "displayName": "Cecilia",
  "operatingUnit": "cecilia",
  "sourceDocs": ["brand-packs/cecilia/COPY.md"],
  "canonicalRepos": ["frankxai/Ana", "frankxai/cecilia-chat", "frankxai/ana-ai-business-kit"],
  "surfaceModes": ["personal-editorial", "conversational-product"],
  "audiences": ["Spanish-speaking readers", "bilingual readers", "people seeking emotional clarity"],
  "positioning": {
    "oneLine": "Owner-reviewed personal and conversational work around psychology, relationships, and lived spirituality.",
    "proof": ["owner-approved writing", "declared credentials", "reviewed conversational boundaries"],
    "failureModes": ["voice impersonation", "diagnostic certainty", "invented biography"]
  },
  "voice": {
    "traits": ["warm", "perceptive", "intimate", "grounded"],
    "bannedPhrases": ["I can heal you", "the universe wants", "as a therapist"]
  },
  "visual": {
    "principles": ["Keep the person human", "Use owner-approved imagery", "Let language carry intimacy"],
    "colors": { "ink": "#241b1f", "paper": "#fff8f3", "warm": "#c76b76" },
    "typography": { "displayRole": "personal warmth", "readingRole": "comfortable bilingual reading" },
    "imageDirection": ["owner-approved portraits", "real environments", "quiet editorial details"]
  },
  "channels": { "primary": ["personal website", "conversation product", "editorial"] },
  "approvals": { "requiredBeforePublicAction": true, "route": "brand-owner-review" },
  "doNotUse": ["synthetic likeness", "invented quotes", "medical or therapeutic promises"],
  "updatedAt": "2026-08-28"
}
